{
  "schemaVersion": 1,
  "format": "hybridclr.dhe-workflow-config.json",
  "projectPath": ".",
  "settingsFile": "ProjectSettings/HybridCLRSettings.asset",
  "outputRoot": "artifacts/dhe-workflow",
  "baselineAotRoot": "releases/previous/stripped-aot",
  "baselineManifestPath": "releases/previous/stripped-aot/dhe-baseline-manifest.json",
  "sourceBoundaryPath": "ProjectSettings/DHE/dhe-source-boundary.json",
  "archiveRoot": "artifacts/dhe-workflow-archive",
  "target": "Android",
  "adapterMethod": "YourGame.Editor.DheWorkflowBuild.Prepare",
  "mode": "Exploratory",
  "runPlayer": false,
  "stopAfterPreflight": true,
  "bootstrap": false,
  "unityTimeoutSeconds": 600,
  "unityArguments": {}
}
